<?xml version="1.0" ?> 
<BubbleWorld  xmlns:xsi="http://www.w3.org/2001/XMLSchema-instance"
	xsi:noNamespaceSchemaLocation="file:/S:/ARS/PA/BWv1/BW/src/xml/xmlSimpleXMLLoader/simpleloader_v1.xsd">


<MobileItems>

  <Bubble id="4"> 
    <PosX>15</PosX>	
    <PosY>15</PosY>
    <Direction>0.0</Direction>
  </Bubble>
    
  <Bubble id="40"> 
    <PosX>15</PosX>	
    <PosY>50</PosY>
    <Direction>3.14</Direction>
  </Bubble>

  <Bubble id="56"> 
    <PosX>50</PosX>	
    <PosY>50</PosY>
    <Direction>2.7</Direction>
  </Bubble>

  <Bubble id="57">
    <PosX>50</PosX>	
    <PosY>15</PosY>
    <Direction>5.34</Direction>
  </Bubble>


  <Stone> 
    <PosX>30</PosX>	
    <PosY>30</PosY>
    <Size>5</Size>	
  </Stone>
    
  <Stone> 
    <PosX>150</PosX>	
    <PosY>40</PosY>
    <Size>40</Size>	
  </Stone>

  <Can>
  	<PosX>150</PosX>
  	<PosY>75</PosY>
  </Can>
  
  <Can>
  	<PosX>190</PosX>
  	<PosY>190</PosY>
  </Can>
  
  <Can>
  	<PosX>75</PosX>
  	<PosY>150</PosY>
  </Can>  
  
  <RemoteBot>
    <PosX>130</PosX>
    <PosY>180</PosY>
    <Direction>1.2</Direction>
  </RemoteBot>
  

  

</MobileItems>


<StationaryItems>

  <Wall> 
    <PosX>180</PosX>	
    <PosY>10</PosY>
    <Length>50.0</Length>
    <Width>3.0</Width>
    <Direction>4.71225</Direction>	
  </Wall>
 
</StationaryItems>

<Window>
   <Width>200</Width>
   <Height>200</Height>
</Window> 
   
   
</BubbleWorld>

